{
  "$schema": "../../scripts/release/schemas/requirements.schema.json",
  "schema_version": 1,
  "requirement_set": "UPSTREAM-MATRIX-v1+INITIAL-OBS-REL-v1",
  "upstream_baseline_sha": "973a041aa2f59f3b05bf31db8187efbfea07017a",
  "row_count": 126,
  "counts": {
    "upstream": 114,
    "obsidian": 9,
    "release": 3
  },
  "evidence_binding": "candidate-evidence-index",
  "fixture_catalog": [
    {
      "id": "FX-01",
      "statement": "Fresh lifecycle: empty vault, first load, reload, and unload with an active timing record.",
      "source_refs": [
        "https://github.com/oldwinter/obsidian-nautilus-log/blob/f3dcf1a000624a705b8c868a4f681339fcd6bedd/docs/research/behavior-inventory.md#minimal-fixture-corpus-for-obsidian-parity-tests"
      ]
    },
    {
      "id": "FX-02",
      "statement": "Settings and migrations: saved preview defaults followed by manual Chinese and custom values.",
      "source_refs": [
        "https://github.com/oldwinter/obsidian-nautilus-log/blob/f3dcf1a000624a705b8c868a4f681339fcd6bedd/docs/research/behavior-inventory.md#minimal-fixture-corpus-for-obsidian-parity-tests"
      ]
    },
    {
      "id": "FX-03",
      "statement": "Parser grammar spanning valid, invalid, zero, progress, completion, formatting, marker, empty, and nested forms.",
      "source_refs": [
        "https://github.com/oldwinter/obsidian-nautilus-log/blob/f3dcf1a000624a705b8c868a4f681339fcd6bedd/docs/research/behavior-inventory.md#minimal-fixture-corpus-for-obsidian-parity-tests"
      ]
    },
    {
      "id": "FX-04",
      "statement": "Reference ownership with direct and nested block references plus source mutation.",
      "source_refs": [
        "https://github.com/oldwinter/obsidian-nautilus-log/blob/f3dcf1a000624a705b8c868a4f681339fcd6bedd/docs/research/behavior-inventory.md#minimal-fixture-corpus-for-obsidian-parity-tests"
      ]
    },
    {
      "id": "FX-05",
      "statement": "Greedy capacity with overlaps, touching events, fragmented gaps, overload, and fit-fragmentation.",
      "source_refs": [
        "https://github.com/oldwinter/obsidian-nautilus-log/blob/f3dcf1a000624a705b8c868a4f681339fcd6bedd/docs/research/behavior-inventory.md#minimal-fixture-corpus-for-obsidian-parity-tests"
      ]
    },
    {
      "id": "FX-06",
      "statement": "Day relation and playback across dates and controlled workday clock phases.",
      "source_refs": [
        "https://github.com/oldwinter/obsidian-nautilus-log/blob/f3dcf1a000624a705b8c868a4f681339fcd6bedd/docs/research/behavior-inventory.md#minimal-fixture-corpus-for-obsidian-parity-tests"
      ]
    },
    {
      "id": "FX-07",
      "statement": "Spiral progress, completion, reopen, cleanup, and fixed-event retention.",
      "source_refs": [
        "https://github.com/oldwinter/obsidian-nautilus-log/blob/f3dcf1a000624a705b8c868a4f681339fcd6bedd/docs/research/behavior-inventory.md#minimal-fixture-corpus-for-obsidian-parity-tests"
      ]
    },
    {
      "id": "FX-08",
      "statement": "Historical Planned and Actual anchors, sessions, open clocks, cross-midnight records, and over-plan actuals.",
      "source_refs": [
        "https://github.com/oldwinter/obsidian-nautilus-log/blob/f3dcf1a000624a705b8c868a4f681339fcd6bedd/docs/research/behavior-inventory.md#minimal-fixture-corpus-for-obsidian-parity-tests"
      ]
    },
    {
      "id": "FX-09",
      "statement": "Responsive surfaces at canonical widths plus sidebar, themes, reduced motion, and debug state.",
      "source_refs": [
        "https://github.com/oldwinter/obsidian-nautilus-log/blob/f3dcf1a000624a705b8c868a4f681339fcd6bedd/docs/research/behavior-inventory.md#minimal-fixture-corpus-for-obsidian-parity-tests"
      ]
    },
    {
      "id": "FX-10",
      "statement": "Primary selection with multiple renderers, prefixes, and direct versus nested tasks.",
      "source_refs": [
        "https://github.com/oldwinter/obsidian-nautilus-log/blob/f3dcf1a000624a705b8c868a4f681339fcd6bedd/docs/research/behavior-inventory.md#minimal-fixture-corpus-for-obsidian-parity-tests"
      ]
    },
    {
      "id": "FX-11",
      "statement": "CLOCK lifecycle across Clock In, reselection, switch, Clock Out, restart, overlap, and completed owner.",
      "source_refs": [
        "https://github.com/oldwinter/obsidian-nautilus-log/blob/f3dcf1a000624a705b8c868a4f681339fcd6bedd/docs/research/behavior-inventory.md#minimal-fixture-corpus-for-obsidian-parity-tests"
      ]
    },
    {
      "id": "FX-12",
      "statement": "Timing retention and alarms around Recent, POMO, and forgotten thresholds.",
      "source_refs": [
        "https://github.com/oldwinter/obsidian-nautilus-log/blob/f3dcf1a000624a705b8c868a4f681339fcd6bedd/docs/research/behavior-inventory.md#minimal-fixture-corpus-for-obsidian-parity-tests"
      ]
    },
    {
      "id": "FX-13",
      "statement": "Standalone POMO across reload, threshold, stop, and same-tick CLOCK precedence.",
      "source_refs": [
        "https://github.com/oldwinter/obsidian-nautilus-log/blob/f3dcf1a000624a705b8c868a4f681339fcd6bedd/docs/research/behavior-inventory.md#minimal-fixture-corpus-for-obsidian-parity-tests"
      ]
    },
    {
      "id": "FX-14",
      "statement": "Execution views and actions across running, paused, completed, tracked, untracked, scheduled, and overflow states.",
      "source_refs": [
        "https://github.com/oldwinter/obsidian-nautilus-log/blob/f3dcf1a000624a705b8c868a4f681339fcd6bedd/docs/research/behavior-inventory.md#minimal-fixture-corpus-for-obsidian-parity-tests"
      ]
    },
    {
      "id": "FX-15",
      "statement": "Commands and navigation across setting, focus, context menu, sidebar, and failure states.",
      "source_refs": [
        "https://github.com/oldwinter/obsidian-nautilus-log/blob/f3dcf1a000624a705b8c868a4f681339fcd6bedd/docs/research/behavior-inventory.md#minimal-fixture-corpus-for-obsidian-parity-tests"
      ]
    },
    {
      "id": "FX-16",
      "statement": "Failures and localization across writer conflict, injected API failures, locales, and unavailable command API.",
      "source_refs": [
        "https://github.com/oldwinter/obsidian-nautilus-log/blob/f3dcf1a000624a705b8c868a4f681339fcd6bedd/docs/research/behavior-inventory.md#minimal-fixture-corpus-for-obsidian-parity-tests"
      ]
    },
    {
      "id": "OFX-001",
      "statement": "Traceability manifest and exact-candidate Evidence Index linkage.",
      "source_refs": [
        "https://github.com/oldwinter/obsidian-nautilus-log/blob/278b3e68c0db50c65b33d572a1a14ec4d8d1e05b/docs/decisions/parity-acceptance-matrix-and-release-gates.md"
      ]
    },
    {
      "id": "OFX-002",
      "statement": "Obsidian host command, menu, notice, navigation, and singleton view workflows.",
      "source_refs": [
        "https://github.com/oldwinter/obsidian-nautilus-log/blob/278b3e68c0db50c65b33d572a1a14ec4d8d1e05b/docs/decisions/parity-acceptance-matrix-and-release-gates.md"
      ]
    },
    {
      "id": "OFX-003",
      "statement": "Canonical visual geometry, breakpoint, theme, state, and text-fit matrix.",
      "source_refs": [
        "https://github.com/oldwinter/obsidian-nautilus-log/blob/278b3e68c0db50c65b33d572a1a14ec4d8d1e05b/docs/decisions/parity-acceptance-matrix-and-release-gates.md"
      ]
    },
    {
      "id": "OFX-004",
      "statement": "Keyboard, focus, screen-reader, reduced-motion, and 200 percent zoom matrix.",
      "source_refs": [
        "https://github.com/oldwinter/obsidian-nautilus-log/blob/278b3e68c0db50c65b33d572a1a14ec4d8d1e05b/docs/decisions/parity-acceptance-matrix-and-release-gates.md"
      ]
    },
    {
      "id": "OFX-005",
      "statement": "Vault write allowlist, stale target, conflict, malformed input, and failure-injection matrix.",
      "source_refs": [
        "https://github.com/oldwinter/obsidian-nautilus-log/blob/278b3e68c0db50c65b33d572a1a14ec4d8d1e05b/docs/decisions/parity-acceptance-matrix-and-release-gates.md"
      ]
    },
    {
      "id": "OFX-006",
      "statement": "Repeated enable, disable, open, close, reload, and unload lifecycle matrix.",
      "source_refs": [
        "https://github.com/oldwinter/obsidian-nautilus-log/blob/278b3e68c0db50c65b33d572a1a14ec4d8d1e05b/docs/decisions/parity-acceptance-matrix-and-release-gates.md"
      ]
    },
    {
      "id": "OFX-007",
      "statement": "English and Simplified Chinese key equality and canonical surface matrix.",
      "source_refs": [
        "https://github.com/oldwinter/obsidian-nautilus-log/blob/278b3e68c0db50c65b33d572a1a14ec4d8d1e05b/docs/decisions/parity-acceptance-matrix-and-release-gates.md"
      ]
    },
    {
      "id": "OFX-008",
      "statement": "Network interception and telemetry persistence matrix for every acceptance fixture.",
      "source_refs": [
        "https://github.com/oldwinter/obsidian-nautilus-log/blob/278b3e68c0db50c65b33d572a1a14ec4d8d1e05b/docs/decisions/parity-acceptance-matrix-and-release-gates.md"
      ]
    },
    {
      "id": "OFX-009",
      "statement": "Deterministic package, scope declaration, policy, install, upgrade, uninstall, and sign-off matrix.",
      "source_refs": [
        "https://github.com/oldwinter/obsidian-nautilus-log/blob/278b3e68c0db50c65b33d572a1a14ec4d8d1e05b/docs/decisions/parity-acceptance-matrix-and-release-gates.md"
      ]
    }
  ],
  "test_catalog": [
    {
      "id": "TC-UP-INS-01-001",
      "requirement_id": "UP-INS-01",
      "evidence_kind": "LIFECYCLE",
      "gates": [
        "G1",
        "G4",
        "G5"
      ]
    },
    {
      "id": "TC-UP-INS-02-001",
      "requirement_id": "UP-INS-02",
      "evidence_kind": "LIFECYCLE",
      "gates": [
        "G1",
        "G4",
        "G5"
      ]
    },
    {
      "id": "TC-UP-INS-03-001",
      "requirement_id": "UP-INS-03",
      "evidence_kind": "LIFECYCLE",
      "gates": [
        "G1",
        "G4",
        "G5"
      ]
    },
    {